2024-12-04,Vargas Elementary,3,y,,Amazing Aircraft I,Y,Y,Y,Y,Y,Y,Very clear hands on exlanation of all the parts of the airlane,,,,Students loves tereal equipment,More clarity about schedule and expectations.,y,We had a wonderful time and the kids learned a lot.  Very friendly staff.q,,Dolan,,,[3],3.0
2024-12-04,Vargas Elementary,3,y,,Amazing Aircraft I,y,y,y,y,y,y,Building the gliders,,,,The whole trip was great!  We loved the interactive parts.,,y,Field trip was well run and engaging.  Thank you.,,Dolan,,,[3],3.0
2024-12-05,Stratford - San Bruno,4,y,,Introduction to Aviation,y,y,n,n,y,y,"Air simulator, the kids loved he hands on aspect to ""fly""","For a first time experience, loved it! Will come back to do it again",,,"Everything, people were helpful and available.  Knowledge was incredibleq",Just the guides/teachers to be a little louder. otherwise fantastic.,y,It was fun.  Full of learning and just overall a great atmosphere.  See you next school year..,,Aiden and Hannah,,N - Kids love using math and sciences tools already. N- My kids do not fear failure in the classroom,[4],4.0
2024-12-05,Stratford - San Bruno,4,y,,Introduction to Aviatiom,Y,Y,Y,Y,Y,Y,we did two activities during our visitt in this program.  Both gave a wonderful and great learning experience andand triggered interest in science and engineering,"Being the first time for me, my experience was fun and greart no improvement suggestions at this point.",,,"Simulation lab and learning abut aitcraft wasveryimportant to drive academic curiosity,",,y,"Being a fourth grade teacher and noting how this years kids enjoyed,I will definitely bring my class next year..",n0,Aidan,,,[4],4.0
2024-12-05,Latimer school,3,y,y,Amazing Aircraft !,Y,Y,Y,Y,Y,Y,Gliders,,,,Everything was excellent,,y,,,,,,[3],3.0
2024-12-05,Latimer school,3,y,y,Amazing Aircraft 1,y,n,n,n,y,y,"The vocab activity with parts of a plane, making the gliders and testing was fun",Maybe some sort of kid friendly explanation as t why the gliders work/dont work ans add an opprtunity to change the experiment to see how to improve flight,Seeing all the different aircraft and the kids loved the hands on elements,"A little hard to hear.  Information could have been simplified.  Maybe have the tour guide ask kids questions abut what they observe to make it more interactive,","The big airplane 747 to explore,","More explanation and hands on about how the airlanes fly,",y,"Unsure, but probably.",,Aidan,,,[3],3.0
2024-12-05,Touchstone Learning,2-5,y,y,Introduction to Aviation,,,,,,,We loved everything,,,,,,y,,,,,,"[2, 3, 4, 5]",3.5
2024-12-05,Lorin Eden Elementary,2,y,,Flight and Motion,y,y,y,y,y,y,Creating an airplane,Vivian was super engaging,,,It was so col going in a plane and the interactive parachute part.,,y,"Yes.  It was fun and a cool experience.  thank you for your accomodating your time,",,Vivian,,,[2],2.0
2024-12-05,Lorin Eden Elementary,2,y,,Flight and Motion,Y,Y,Y,Y,Y,Y,We havent studied airplanes yet.  This is going to lead to a great follow-up lesson for us in class,We thought the timing was perfect and the instructor was awesome! 9:30 presentation,,,The students loved exploring.  /the excitement was real.  We were here 2 1/2 hours and thought it was great timing.,"I thought you did a great job with the set-up.  Would it be possible for a guided tour of the museum,",y,Thank you for the experience.,,Vvian,,,[2],2.0
2024-12-06,Evergreen Elementary,5,y,y,ADC Helicopters,Y,Y,Y,Y,Y,Y,The students had a bast with the test simulator,Ni suggestions,Tour guide had awesome energy and Knowledge,Perhaps guides could have personal microphones so students can hear a bit better.  He was a bit drowned out by the students from the simulators,Well organized.  Appropriate engaging stations.,,y,Great way of teaching science hands on.  Each station was just long enugh.  Professional staff.,,"Abigail, Aidan, Vivian",,,[5],5.0
2024-12-06,Evergreen Elementary,5,y,y,ADC Helicopters,Y,Y,Y,Y,Y,Y,,,,,,,,,,,,,[5],5.0
2024-12-06,Evergreen Elementary,5,y,y,ADC Helicopters,Y,Y,Y,Y,Y,Y,"It was fun, interestong",More modeling.  Explaiming how to make it.,"Interesting copters, planes to see.  Good info.",Talk more about the other planesrather than only two.,"The simulator, cockpit, hands on.",A little modeling for the hands on.,y,They loved it.  Learned a lot.,,Abigail Aidan and Vivian,,,[5],5.0
2024-12-06,Evergreen Elementary,5,y,y,ADC Helicopters,y,y,y,?,y,y,/The design challenge,We were short on time,Tje docents were a wealth of knowledge,More time to see more of the museum,The Design Challenge,more time,y,It was a great experience! they were able to take what they learned in the classroom and implement it in the design challenge.,,Abigail Aidan and Vivian,,,[5],5.0
2024-12-09,Kid's Connection,1,y,,Eye on the Sky,Y,Y,Y,Y,Y,Y,2 hands on activities,,,,Interactive search,,y,,,Vivian,,,[1],1.0
2024-12-09,Kid's Connection,1,y,,Eye on the Sky,Y,Y,Y,Y,Y,Y,Completing the water cycle bracelet.  The involvement as they learned was key.,"Materials already out and prepared.  (lots of wasted time passing out).  The cloud activity was boring,(just cutting and pasting), not engaging for the kids.  They lost interest,",,,Water cycle and exploring,More indoor space for eating.,y,We enjoyed usingthe program to begin our unit.,,,,,[1],1.0
2024-12-09,Stratford School - San Bruno,3,y,y,Flight and Motion,Y,Y,N,Y,Y,Y,Students doing their own planed.  Trying different weights and throw planes.,,The planes,Adding more experimental exhibits,Being able to allign the program to student's science forces units.,,y,The ability to connect curriculum to the program here,,Abigail,,,[3],3.0
2024-12-09,Stratford School - San Bruno,12,y,y,Flight and Motion,Y,Y,Y,Y,Y,Y, The best part is when the students can physically involved in the activity,The hands on program is already ding good forkids.,Very informative and stimulating the mind of our students in learning more abut aviation,Tjey are all doing a great job.  Kudos!,"It is informative, organized and child friendly",You can use a Hiller mascot to welcome tje students,y,Absolutely,,,,,[12],12.0
2024-12-10,Ponderosa Elementary,4,y,,Flight Simulator lab,y,Y,Y,Y,Y,Y,Hands-on,Wonderful,,,"Everything hands-on, simulation, and going inside a plane",Two Thumbs up,y,100% awesome,,Abogail,,,[4],4.0
2024-12-10,Ponderosa Elementary,4,Y,,Flight Simulator lab,y,y,y,y,y,y,All the different simulators,,,,,,y,,,Abigail,,,[4],4.0
2024-12-10,Ponderosa Elementary,4,y,,Flight Simulator lab,Y,Y,Y,Y,Y,Y,They had fun flying and working together,none,,,Everything was great.  Students had fun.  Educatinal and interesting,,y,,,Abigail,,,[4],4.0
2024-12-10,Bishop Elementary,2,y,,Amazing Aircraft I,Y,Y,Y,Y,Y,Y,My students loved building the planes.  I loved that tere was extra focus on the parts of the plane.,,"We could have more hands on elements earlier.  Tje presentation was interesting, but 45 minutes is tough for young ones",,Our students loved it,,y,You all did such an amazing job,,"Aidan, Vivian",,,[2],2.0
2024-12-10,Bishop Elementary,2,y,,Amazing Aircraft 1,y,y,,,y,y,Making and testing the plane,More engaging presentations,,,Exploring,,y,,,"Aiden, Vivian",,,[2],2.0
2024-12-10,Bishop Elementary,2,y,,Amazing Aircraft 1`,Y,Y,Y,N,Y,Y,The hands on experience was engaging and gave my students a chance to interact with STEM concepts in a unique way,There could be more opportunities for students to experience failuer and retry their projects to encurage problem solving.,,,The best part was gimg inside the big plane outside (my stdents loved ir)Exploring the curated airplane exhibits which captivated the students and sparked curiosity.,"Overall the experience was good.  Perhaps by incorporating more interactive elements would make it even more impactful for students,",Y,The museum provided a unique educatonal experience that aligned well with STEM learning objectives,,"Aidan, Viivian",qq,,[2],2.0
2024-12-10,Bishop Elementary,2,y,,Amazing Aircraft 1,Y,Y,Y,Y,Y,Y,Building the airplanes,"We were the secong group and the program ran behind.  Interaction with students, answering wuestions, student responses.",,,"Fre exploration. Every worker was so nice, welcoming and helpful",,y,,,"Aiden, Vivian",,,[2],2.0
2024-12-12,Southgate Elementary,4,y,,Flight Simulator Lab,Y,Y,Y,Y,Y,Y,Flying the paper airplanes,More activtes,,,Good,,y,,,Aidan,,,[4],4.0
2024-12-12,John F. Kennedy Elementary,k,y,,Amazing Aircraft I,Y,Y,Y,Y,Y,Y,Building airplanes,Less fragile materials,,,Lots of interactive stuff,all great,y,"Generous grant.  Lots to do, good for a variety of ages.",,,,,[],
2024-12-12,Southgate Elementary,4,y,,Flight Simulator Lab,Y,Y,Y,Y,Y,Y,Allowing students to have a variety of hands-on experiences without limitations,Having outdoor hands-on activities.  Having drone plex open.  They were really looking forward to it.,,,The amunt of exhibits and experiences,Having placcards and information without difficult vocabulary words to compliment the original placard ,y,This was aneducational and memorable experience. ///this was great for the ages that we brought.,,Aidan,,,[4],4.0
2024-12-12,John F. Kennedy Elementary,k,y,,Amazing Aircraft I,Y,Y,Y,Y,Y,Y,The students enjoyed the paper airplane launcher and the glider coloring activity.  They liked sitting in the varous cockpits,This was super fun.  thank you,,,The exhibits were very detailed and thank you for having a place to play,It was perfect,y,qThank you for a wonderful first time field trip for my kindergarteners.,,Vivian,,,[],
2024-12-13,The Hamlin School,4,y,y,ADC Helicopters,Y,Y,Y,Y,Y,Y,"The design challenge was super fun. Also they dont get a lot of experience with ""failure"" or healthy competition.  So good",Nada,"Aidan was amazing.  Knowledgeable, funny, kind, encouraging.  We love the flight simulator.",Nothing.  Everything was very well timed for  interest and attention span. ,,,,,,Hannah,Aidan,,[4],4.0
2024-12-13,The Hamlin School,4,y,y,ADC Helicopers ,Y,Y,Y,Y,Y,Y,"The simulator, making the helicopters, and tour, All was great",,Great info.  Short.  incorporated influential women.,none,Already said.,none,y,Great fun experience.,,Hannah,Aidan,,[4],4.0
2024-12-17,Mariano Castro Elementary,2,y,,Amazing Aircraft,Y,Y,N,N,Y,Y,Making the planes,A shorter talk before the hands on part.,,,The large plane outside,A few more activities in the gallery,y,This is a great field trip,,Dolan,,,[2],2.0
2024-12-17,Campbell School of Innovation,5,y,y,ADC Helicopters,Y,N,,,,,Good design sprint - Fun,Shorter testing/competition.  Too long at end of sprint.,The tour guide was super kind and very knowledgeable.  Kept kids engaged.,Quicker stops at each portion so more can be seen,Easy day.  Good for students,,y,,,,Abigail and /vivian,,[5],5.0
2024-12-17,Campbell School of Innovation,5,yy,y,ADC Helicopters,Y,Y,Y,Y,Y,Y,Daign Challenge,written directions available in Spanish for our Spanish speaking students,Seeint the models,,Flight Simulator.  Carl was amazing and so friendly,,y,,,"Aidan, Vivian, Abigail, Carl",,,[5],5.0
2024-12-17,Campbell School of Innovation,5,y,y,ADC Helicopters,Y,Y,Y,Y,Y,Y,Students enjoyed a simulator and watching their projects be tested,"The testing part of the competition took too long,",Seeing all the air crafts and learnig  how they work.,It was difficult to hear our tour guide.  Mics would be very helpful,The design challenge and design testing.  /students enjoyed watching their creations get tested.,Not enough time for breaks/snacks/ food.  Students need time to eat and fuel up.,y,The design competition was great.,,,,,[5],5.0
